movie_id,title,release_date,description,score,thumbnail,parsed_date,release_year,release_month,release_day
11506,But I'm a Cheerleader,"July 7, 2000","Suspected of being a lesbian, an unsophisticated teenager is sent to rehab camp by her conventional parents and friends.",39,https://static.metacritic.com/images/products/movies/7/3ef963fd418ccc2006de87e267aa1867-98.jpg,2000-07-07,2000,7,7
11509,Double Parked,"September 22, 2000","A comedic drama about a feisty urban single mom, and her ailing adolescent son, struggling to survive while their lives are on a collision course with destiny.  (Fierce Films)",38,https://static.metacritic.com/images/products/movies/3/547374f408da9b5aac78608a69aea051-98.jpg,2000-09-22,2000,9,22
11510,God's Army,"August 25, 2000",A movie about the experiences of a group of Latter-Day Saints missionaries working in Los Angeles.,38,https://static.metacritic.com/images/products/movies/9/b6080d658f23c758dba872402dca11ca-98.jpg,2000-08-25,2000,8,25
11512,Looking for an Echo,"November 10, 2000","Chronicles two old pals in middle age as they look back to when they were teenage musical stars. Vinnie (Assante), a well-to-do bartender is a widower with three children, the youngest suffering from lukemia. Vinnie proposes marriage to his daughter's nurse (Venora) and starts a new life.",38,https://static.metacritic.com/images/products/movies/7/1156ec0b3ffede98afae695b729fdae4-98.jpg,2000-11-10,2000,11,10
11513,The Specials,"September 22, 2000","A post-modern comedy that sets out to do for the superhero genre what ""Scream"" did for horror films.  (Regent Entertainment)",38,https://static.metacritic.com/images/products/movies/1/9c2bb2a3f3ac1899ddb71cf91d519fd0-98.jpg,2000-09-22,2000,9,22
11515,The Crew,"August 25, 2000","To save their retirement home, four former mobsters plan one last job.",37,https://static.metacritic.com/images/products/movies/9/1069989f4efbdb52bd023937eb4db7db-98.jpg,2000-08-25,2000,8,25
11520,8 ½ Women,"May 26, 2000","Two wealthy businessmen, a father and son, decide to set up their own brothel. . .an erotic fantasy  (including father-son incest).",36,https://static.metacritic.com/images/products/movies/8/0945bff80fd97fc63080256e26676f83-98.jpg,2000-05-26,2000,5,26
11523,Love's Labour's Lost,"June 9, 2000","Branagh turned Shakespeare's ""Love's Labour's Lost"" into a 1930s-style romantic musical comedy, topped with retro dance numbers and classic songs.",35,https://static.metacritic.com/images/products/movies/98w-movie.jpg,2000-06-09,2000,6,9
11526,Loser,"July 21, 2000","Labelled a loser by his roomates, a college student (Biggs) is booted from his dorm and falls in love with a coed (Suvari) who has feelings for their professor (Kinnear).",35,https://static.metacritic.com/images/products/movies/2/136f2ca0ca5d3bf606dc57e440f9b6b3-98.jpg,2000-07-21,2000,7,21
11536,Loving Jezebel,"October 27, 2000",A young man (Harper) has found throughout his entire life that he is cursed with falling in love with other men's women.,33,https://static.metacritic.com/images/products/movies/98w-movie.jpg,2000-10-27,2000,10,27
11544,Gossip,"April 21, 2000","Sex, deception and rumor detonate when fellow university students and roommates Derrick (Marsden), Jones (Headey) and Travis (Reedus) collaborate on their new journalism class assignment: identifying the link between news and gossip.  (Warner Brothers)",31,https://static.metacritic.com/images/products/movies/2/2c16c4afb2eb3fc16d236008f58d67df-98.jpg,2000-04-21,2000,4,21
11558,Pokémon: The Movie 2000,"July 21, 2000","Good forces try to stop Lugia, whose power could destroy the world.",28,https://static.metacritic.com/images/products/movies/4/01bc0288c5239f27a70cac78bceae0bd-98.jpg,2000-07-21,2000,7,21
11562,Dracula 2000,"December 22, 2000","Dracula, freed at last from a century in confinement, finds himself in a 21st century of chaos and temptation.  (Dimension Films)",26,https://static.metacritic.com/images/products/movies/6/bedce04efc947b7ae956586128aed49a-98.jpg,2000-12-22,2000,12,22
11564,Here on Earth,"March 24, 2000","The lives of three young people - a rich student, a girl from the ""wrong side of the tracks"" and her boyfriend - unexpectedly intersect during one fateful summer.  (Twentieth Century Fox)",25,https://static.metacritic.com/images/products/movies/5/27483e978b82a9e6d9fb656b1a3e038f-98.jpg,2000-03-24,2000,3,24
11566,The Next Best Thing,"March 3, 2000","A story about best friends, one a single straight woman (Madonna) the other a gay man (Everett). One night they get drunk...she gets pregnant...and the two decide to form a family despite their sexual preferences.",25,https://static.metacritic.com/images/products/movies/0/395600619ddd83169d8a64766ed319d1-98.jpg,2000-03-03,2000,3,3
11567,Knockout,"February 4, 2000",This inspiring movie tells the story of determined young woman (Hernandez) from East L.A. who enters the world of professional boxing.,25,https://static.metacritic.com/images/products/movies/4/de4a0f8bbaab1c1a88a41c755a34fae7-98.jpg,2000-02-04,2000,2,4
11568,Autumn in New York,"August 11, 2000","A sweet, but terminally ill, young woman is seduced by an aging playboy.",24,https://static.metacritic.com/images/products/movies/3/5011bbff201ad8b4e3bf68fc7a8cd910-98.jpg,2000-08-11,2000,8,11
11571,Hollow Man,"August 4, 2000","A government scientist (Bacon) discovers how to make people invisible.  After a freak accident that makes him slowly disappear, he begins to go insane and seeks revenge on the other scientists on the project.",24,https://static.metacritic.com/images/products/movies/4/54bca688b8fa85d66d5c294c6f611176-98.jpg,2000-08-04,2000,8,4
11573,Beautiful,"September 29, 2000","On her way to becoming Miss America, a poor girl (Driver) faces her life's goal and discovers what is really important.",23,https://static.metacritic.com/images/products/movies/9/a58510db7084708fc07cbd51cc18446c-98.jpg,2000-09-29,2000,9,29
11578,Better Living,"August 4, 2000","A comedy about families, the elements that bind them together, and about hope in the face of hardship.  (Goldheart Pictures)",21,https://static.metacritic.com/images/products/movies/9/631feb134f6ba9947be836ec3d049d61-98.jpg,2000-08-04,2000,8,4
11590,Dungeons & Dragons,"December 8, 2000","The Empire of Izmer has long been a divided land. The Mages - an elite group of magic users - rule whilst the lowly commoners are powerless. Izmer's
young Empress, Savina (Birch), wants equality and prosperity for all, but the evil Mage Profion (Irons) is plotting to depose her, and establish his
own rule. (Wizards of the Coast)",14,https://static.metacritic.com/images/products/movies/7/a0031c61623f527635fd03abc5b4141f-98.jpg,2000-12-08,2000,12,8
11597,Strippers,"December 8, 2000","Alan is having an horrendous day...he loses his job, money is missing from his bank account, he is evicted from his apartment, misses a date with his girlfriend and much more.",5,https://static.metacritic.com/images/products/movies/2/64499a73e6c8b21731a440b0702680e9-98.jpg,2000-12-08,2000,12,8
11518,The Adventures of Rocky & Bullwinkle,"June 30, 2000","Escaping the bounds of their two-dimensional cartoon world, Cold War spies Boris and Natasha are pursued by fearless heroes Rocket J. Squirrel and Bullwinkle Moose.",36,https://static.metacritic.com/images/products/movies/9/02d5fe88b7436cb4b70364155ab01a16-98.jpg,2000-06-30,2000,6,30
11525,102 Dalmatians,"November 22, 2000","Just when it seemed safe to come out of the kennel, Cruella De Vil is back and this time she's not alone.  (Walt Disney Pictures)",35,https://static.metacritic.com/images/products/movies/9/2b1a87cdeb228f3a527f259c7638016c-98.jpg,2000-11-22,2000,11,22
11527,Red Planet,"November 10, 2000","Mission Commander Kate Bowman (Moss) is the pilot and commander of the most important mission of the 21st century: saving the human race. It's 2050, Earth is dying, and colonizing Mars is the only alternative to obliteration.  (Warner Bros.)",34,https://static.metacritic.com/images/products/movies/7/d90d22fc8755a066ad7316477861aed5-98.jpg,2000-11-10,2000,11,10
11529,Grizzly Falls,"January 28, 2000","Young Harry is still dealing with the death of his mother when he joins his esrtranged father on an expedition to the Canadian Rockies to capture a grizzly.  Harry gets separated from the group and must learn to fend for himself.  While his father sets out to find him, the bear becomes somewhat of a companion, guiding Harry through the wilderness and teaching him how to survive in the wild.",34,https://static.metacritic.com/images/products/movies/6/7413daebcf84d2d20564cb548855e967-98.jpg,2000-01-28,2000,1,28
11530,$pent,"July 21, 2000","This comic drama examines the relationships and addictions of a group of twenty-something friends with very dysfunctional, yet interesting lives. (Regent Releasing)",34,https://static.metacritic.com/images/products/movies/6/34bb6b36a19e533f6bae8eeef5b59b75-98.jpg,2000-07-21,2000,7,21
11538,Big Momma's House,"June 2, 2000","Disguised as an old lady, an FBI agent (Lawrence) attempts to protect a beautiful federal witness and her son.",33,https://static.metacritic.com/images/products/movies/2/482112025bf1ca36f0fa6b7a2f296d5d-98.jpg,2000-06-02,2000,6,2
11547,American Virgin,"June 2, 2000","Unhappy with her father's double standards,  a woman decides to lose her virginity.",30,https://static.metacritic.com/images/products/movies/8/c87ff8099c3826f1310d93488e081627-98.jpg,2000-06-02,2000,6,2
11548,"Dude, Where's My Car?","December 15, 2000","Last night, two party-hearty Dudes had an unbelievably sweet time. Too bad, they can't remember a thing, including where they parked their car. So, the Dudes embark on a mission: retrace their steps to find out what they did last night (and who they did it to), hoping it will lead them to the missing car. Little do the Dudes know, they're in for the ride of their lives. (20th Century Fox)",30,https://static.metacritic.com/images/products/movies/2/002a92908a8acc6ab9b9f0bed5853e4f-98.jpg,2000-12-15,2000,12,15
11549,The Replacements,"August 11, 2000","It's late in the season; the playoffs are fast approaching; and the Washington Sentinels have just gone on strike. Scrambling for a solution, the owner Edward O'Neil (Warden) hatches a plan to bring in legendary coach Jimmy McGinty (Hackman) to recruit a team of replacement players in exactly one week.  (Warner Brothers)",30,https://static.metacritic.com/images/products/movies/0/1853d894db03d31c2826a22348399edd-98.jpg,2000-08-11,2000,8,11
11550,Where the Heart Is,"April 28, 2000","Abandoned by her boyfriend at a Wal-Mart, a pregnant 17 year-old (Portman) rebuilds her life.",30,https://static.metacritic.com/images/products/movies/3/9321fbc9bd8b4a606739b27b29298412-98.jpg,2000-04-28,2000,4,28
11555,Wildflowers,"September 1, 2000",A 17 year-old girl's life is changed forever when she becomes involved with a mysterious girl.,28,https://static.metacritic.com/images/products/movies/4/6e8d99fba7a33e2a8c07c552e3e901e4-98.jpg,2000-09-01,2000,9,1
11557,Third World Cop,"April 14, 2000","Set in Kingston, Jamaica, a cop goes back to his old hood.",28,https://static.metacritic.com/images/products/movies/1/3697b2675c5a7329826424cd7b6bdb81-98.jpg,2000-04-14,2000,4,14
11560,Coyote Ugly,"August 4, 2000","Graced with a velvet voice, 21-year-old Violet Sanford (Perabo) heads to New York to pursue her dream of becoming a songwriter only to find her aspirations sidelined by the accolades and notoriety she receives at her ""day"" job as a barmaid at Coyote Ugly.  (Touchstone Pictures)",27,https://static.metacritic.com/images/products/movies/3/3c744dc379316d996859387749878847-98.jpg,2000-08-04,2000,8,4
11570,Get Carter,"October 6, 2000","Hit man Jack Carter (Stallone), a mob enforcer in New York, returns to his hometown of Los Angeles for his brother's funeral. Realizing the death was not an accident, Carter seeks revenge.",24,https://static.metacritic.com/images/products/movies/4/d2274b60c1c57268e640ed7f93a4d895-98.jpg,2000-10-06,2000,10,6
11576,The Watcher,"September 8, 2000","A former FBI agent (Spader) tracking a serial killer (Reeves) gives up solving the crimes after 8 years. The agent moves to another city, but the killer finds him and starts sending photographs of new victims -- one of which is (Tomei), the agent's psychiatrist.",22,https://static.metacritic.com/images/products/movies/6/e5a301a2fb84463da1eb90e05ba91afd-98.jpg,2000-09-08,2000,9,8
11582,Thomas and the Magic Railroad,"July 26, 2000",A magic journey happens when a young girl visitis her grandfather and finds herself on a special train pulled by an engine named Thomas.,19,https://static.metacritic.com/images/products/movies/0/58592bb18d2d959faff5f77e790ba132-98.jpg,2000-07-26,2000,7,26
11583,Supernova,"January 14, 2000",Supernova chronicles the lives of a six-man crew and their search and rescue mission in deep space in the early 22nd Century.,19,https://static.metacritic.com/images/products/movies/5/237ae19262075040834c8bc71cc009ab-98.jpg,2000-01-14,2000,1,14
11593,3 Strikes,"March 1, 2000",Hooks plays a character who is just released from jail following his second offense.  The state has adopted a  three strikes rule and his next offense will possibly land him in prison for life.,11,https://static.metacritic.com/images/products/movies/7/15448c1eb452e628f326c5c8774feb6c-98.jpg,2000-03-01,2000,3,1
11594,Whipped,"September 1, 2000",Every Sunday a group of friends get together to discuss their woman-chasing escapades.   One week they discover that they are all picking up on the same girl.,10,https://static.metacritic.com/images/products/movies/6/9d1ecf40b44a9818c48907dbb70b6b96-98.jpg,2000-09-01,2000,9,1
11596,Screwed,"May 12, 2000","Working for a wealthy boss, a chauffeur kidnaps her dog and holds it for ransom.  Accidentally the boss gets the dog back and thinks the chauffer has been kidnapped.",7,https://static.metacritic.com/images/products/movies/4/b7f76a9163c0ad068b90c7775e383174-98.jpg,2000-05-12,2000,5,12
11234,"Crouching Tiger, Hidden Dragon","December 8, 2000","In 19th century China, a magical sword given by a warrior (Chow Yun-Fat) to his lover (Michelle Yeoh) is stolen and the quest to find it ensues.  The search leads to the House of Yu where the story travels in a different direction with the introduction of a mysterious assassin and another love story.",94,https://static.metacritic.com/images/products/movies/8/14fcb1c06981a24cb29a3fd899321d6a-98.jpg,2000-12-08,2000,12,8
11242,You Can Count on Me,"November 10, 2000","A young mother (Laura Linney) is cheating on her fiancé (Jon Tenney) with her boss (Matthew Broderick), and her life becomes further complicated by the return home of her wild brother (Mark Ruffalo).",85,https://static.metacritic.com/images/products/movies/4/4eff3cbda4066a6b1ba2dcf4e11cf7e2-98.jpg,2000-11-10,2000,11,10
11244,Paragraph 175,"September 13, 2000","During World War II 100,000 German homosexual men were sent to concentration camps.  This documentary tells their story and includes personal accounts of six of the survivors.",85,https://static.metacritic.com/images/products/movies/0/e972093e884e80bbce04fd1be959e846-98.jpg,2000-09-13,2000,9,13
11256,Chunhyangdyun,"December 29, 2000","Set in 18th century Korea, this story of young lovers from different social castes is based on a Korean folk tale.",79,https://static.metacritic.com/images/products/movies/8/6f53dbab21d25787bc43ca19b11f4004-98.jpg,2000-12-29,2000,12,29
11261,The House of Mirth,"December 22, 2000",Lily Bart (Anderson) is a ravishing socialite at the height of her success who quickly discovers the precariousness of her position when her beauty and charm start attracting unwelcome interest and jealousy.  (Sony Pictures Classics),78,https://static.metacritic.com/images/products/movies/7/df9941db91d809858dab547ddebeb407-98.jpg,2000-12-22,2000,12,22
11264,Best in Show,"September 27, 2000","Centered at the Mayflower Kennel Club Dog Show, the film follows several bizarre dog owners and their sometimes neurotic pets.",78,https://static.metacritic.com/images/products/movies/9/38aa091b55d693c82a1490c239775683-98.jpg,2000-09-27,2000,9,27
11265,Human Resources,"September 15, 2000","Franck (Lespert), a Parisian business school student, takes an internship in the Human Resources department at the factory where his father (Vallod) has labored for 30 years. Franck's efforts lead to the firing of many employees, including his father.  (Shooting Gallery)",78,https://static.metacritic.com/images/products/movies/0/86005b3ace827ffe8297f0c3f26896d5-98.jpg,2000-09-15,2000,9,15
11268,Humanité,"June 16, 2000","A police detective with unusual methods investigates the murder of an 11-year-old girl; the film is about his daily life, including the yearning he has for his neighbor.",77,https://static.metacritic.com/images/products/movies/6/abbf383462d39e88db5acc91af4022bd-98.jpg,2000-06-16,2000,6,16
11270,Shanghai Noon,"May 26, 2000","When Lo Fong (Roger Yuan) kidnaps the Emperor's daughter, Princess Pei Pei (Lucy Liu), and takes her to America, the Emperor sends his best Imperial Guardsman to find her. Chon Wang (Jackie Chan), one of the Emperor's least distinguished guards, insists on joining them.  He feels responsible for the kidnapping and wants to make amends. However, while the rescue party scours the West, Chon Wang gets separated from the group and soon becomes lost. When he crosses paths with Roy O'Bannon (Owen Wilson), a small-time outlaw, the two become unlikely allies.",77,https://static.metacritic.com/images/products/movies/2/ef20691e90914fec9dc5fcc4c2d67327-98.jpg,2000-05-26,2000,5,26
11271,Jesus' Son,"June 16, 2000","Stumbling across America in the 1970's, a young junkie (Crudup) searches for meaning in everything from sex and drugs to meetings with strangers.",76,https://static.metacritic.com/images/products/movies/0/bbab0366735cf429195870a93e77c432-98.jpg,2000-06-16,2000,6,16
11275,The Virgin Suicides,"April 21, 2000","After the suicide death of their youngest sister, the surviving daughters of the Lisbon family descend into a deep melancholy and eventually become isolated socially and physically by their parents (Woods, Turner) within their small-town Michigan house.  Their only contact with the outside world is a group of neighborhood boys who become obsessed with watching and attempting to communicate with the girls.",76,https://static.metacritic.com/images/products/movies/4/be5c782a2d5139f9f1a2205cf1cd2f26-98.jpg,2000-04-21,2000,4,21
11276,Things You Can Tell Just by Looking at Her,"January 22, 2000","Five loosely intertwined stories of the emotional issues facing individual middle-aged Angelenas are presented. In ""This Is Dr. Keener"", physician Elaine Keener is spending the day taking care of her invalid mother at home on the nurse's day off. Elaine, a scientist, seeks confirmation on what may be a turning point issue in her life by an unconventional means, namely a tarot card reading. Although the news Elaine receives through the reading is a largely accurate assessment of her current life, it is the news about that crossroads issue that takes her somewhat aback. In ""Fantasies About Rebecca"", thirty-nine year old Rebecca Waynon is outwardly in control of her life, from her job as a bank manager to her personal long term relationship with older Robert. A homeless woman named Nancy who hangs around outside the bank seems to have a clearer picture of what is truly happening with Rebecca than Rebecca herself, as is witnessed by Rebecca's ultimate reaction to an action in dealing with a personal issue. In ""Someone for Rose"", divorced mother Rose's life is focused on making sure her fifteen year old son Jay is turning into a respectable young man. Between that and her new work as a writer of children's books, Rose doesn't seem to have time to look for love, which changes when Albert, a dwarf, moves in across the street. In ""Goodnight Lilly, Goodnight Christine"", lesbian couple Christine and Lilly discuss their relationship - past, present and future - as they deal with Lilly's terminal illness. And in ""Love Waits For Kathy"", police detective Kathy Faber lives with her blind sister Carol Faber. Although Carol has an active life - social and professional, the former which includes dates - and is more than capable of managing on her own as she is highly perceptive, Kathy, under the surface, treats Carol with kid gloves to make sure she's all right in dealing with life considering her physical disability. As such, Kathy has let her personal life largely slip by her. But is it too late for Kathy?",76,https://static.metacritic.com/images/products/movies/1/979b83f83e471324d1f24675bf02a4c5-98.jpg,2000-01-22,2000,1,22
11278,State and Main,"December 22, 2000","A big-budget movie crew descends upon a quaint New England village, sowing a bumper crop of corruption, vanity and greed.  (Fine Line Features)",75,https://static.metacritic.com/images/products/movies/9/4eb97f1698980555c02752b4691726a5-98.jpg,2000-12-22,2000,12,22
11281,Girl on the Bridge,"July 28, 2000","A girl on a bridge who contemplates suicide is met by a professional knife thrower.  He recruits her to become the new human target in his travelling circus act in France, where the girl encounters a new sensual and suspenseful lifestyle.",75,https://static.metacritic.com/images/products/movies/2/7d1795d32c13e5b353c109e3f3f3f4a3-98.jpg,2000-07-28,2000,7,28
11285,The Specialist,"April 14, 2000","Eyal Silvan's documentary of the 1961 trial of former SS official Adolf Eichmann, cut from 350 hours of footage, details how three Isreali judges had to determine over the course of eight months the extent to which Eichmann (known as the ""specialist"" for his transportation of the Reich's Jewish population) could be held legally responsible for the deaths of millions.",75,https://static.metacritic.com/images/products/movies/7/5bc9b1fb4525b3f0b5a0314838042aad-98.jpg,2000-04-14,2000,4,14
11289,East Is East,"April 14, 2000","Set in England during the 1970's, a traditional Pakistani man (Om Puri) finds his family's actions are definitely taking on non-traditional qualities.",74,https://static.metacritic.com/images/products/movies/1/fedd535359f14418b0469b72d75e5c5a-98.jpg,2000-04-14,2000,4,14
11290,Judy Berlin,"February 25, 2000","When the small suburban town of Babylon, Long Island, in engulfed in the darkness of a strange solar eclipse, two former classmates (Harnick and Falco) pass the day reminiscing.  (Shooting Gallery)",74,https://static.metacritic.com/images/products/movies/1/e46da766c2d0265ad06a785dc46f9ed1-98.jpg,2000-02-25,2000,2,25
11295,Such a Long Journey,"March 24, 2000","Set on the eve of the 1971 war between India and Pakistan, the members of the Noble family in tension-filled  Bombay vehemently disagree about what to do when an old friend, a soldier who'd abruptly disappeared, finally contacts them, only to ask a dangerous favor.  Parsi Gustad Noble's (Seth) apparently close-knit family is held together precariously, their fraying bonds mirroring their once genteel, deteriorating housing compound.",74,https://static.metacritic.com/images/products/movies/9/e81d91e4bb717a14a94f7753229c6dcf-98.jpg,2000-03-24,2000,3,24
11299,Erin Brockovich,"March 17, 2000","An unconventional drama based on true events, starring Julia Roberts as the twice-divorced mother of three young children who sees an injustice, takes on the bad guy and wins.  (Universal Pictures)",73,https://static.metacritic.com/images/products/movies/2/f62d7857363a4b5072a3cff8c72a35e3-98.jpg,2000-03-17,2000,3,17
11302,Titanic Town,"September 1, 2000","In 1972, a Belfast mother (Walters) becomes involved in a woman's peace group which causes her family trouble with IRA sympathizers.",73,https://static.metacritic.com/images/products/movies/1/4a2af3533d212b46cb83fcd2b884d45b-98.jpg,2000-09-01,2000,9,1
11303,Space Cowboys,"August 4, 2000","In the 1950's, one of the first satellites was launched.  Today, it is malfunctioning and threatening the Earth, and the original astronaut (Eastwood) is asked to go and do repairs.  He wants three old air force buddies to go with him into space for the last time and fix it.",73,https://static.metacritic.com/images/products/movies/8/1aa8e0554fb71cffbd58bf92495f33bc-98.jpg,2000-08-04,2000,8,4
11306,Not One Less,"February 18, 2000","In a remote mountain village, the teacher (Gao) must leave for a month to care for his mother. The mayor can find only a 13-year old girl (Wei)  to substitute, even though she is only a few years older than her students.",73,https://static.metacritic.com/images/products/movies/6/3c87790e2f93100094d98932b752fd93-98.jpg,2000-02-18,2000,2,18
11309,Aimee & Jaguar,"August 11, 2000","In 1943, while the Allies are bombing Berlin and the Gestapo is purging the capital of Jews, a dangerous love affair blossoms between two women.  (Zeitgeist Films)",72,https://static.metacritic.com/images/products/movies/2/7e4cab136cad3af7bbba826915c29539-98.jpg,2000-08-11,2000,8,11
11310,Lupin III: The Castle of Cagliostro,"January 1, 2000",A flamboyant thief and his gang struggle to free a princess from an evil count's clutches and to learn the hidden secret to a fabulous treasure that she holds part of a key to.,72,https://static.metacritic.com/images/products/movies/5/d52aa00e8d69d1894b39077572eb44b8-98.jpg,2000-01-01,2000,1,1
11315,Benjamin Smoke,"July 21, 2000",A documentary which examines the life of the HIV-positive leader of the Atlanta band Smoke.,71,https://static.metacritic.com/images/products/movies/2/cc414284b5539b27047abe951fa5db20-98.jpg,2000-07-21,2000,7,21
11322,Shadow Boxers,"May 12, 2000","An upbeat documentary portrait of the world of women's boxing, focusing on Dutch-born boxer Lucia Rijker.",70,https://static.metacritic.com/images/products/movies/9/3c51d2ec82b4fddd35b2f040b8063e6d-98.jpg,2000-05-12,2000,5,12
