movie_id,title,release_date,description,score,thumbnail,parsed_date,release_year,release_month,release_day
11249,George Washington,"October 27, 2000","Set in the landscape of a rural Southern town, George Washington is a stunning portrait of how a group of young kids come to grips with a hard world of choices and consequences. During an innocent game in an abandoned amusement park, a member of the group dies.  (Cowboy Booking International)",82,https://static.metacritic.com/images/products/movies/9/4f5fb215b36cef53f2dd65703877d37f-98.jpg,2000-10-27,2000,10,27
11250,I'm the One That I Want,"July 7, 2000","Set in San Francisco's Warfield Theatre, this concert film starring comedienne Margaret Cho covers a wide variety of topics including her mother, drug and alcohol abuse, homosexuality, and the failure of ""All-American Girl,"" a network television comedy starring Ms. Cho as the anti-stereoytypical daughter of an Asian-American family.",81,https://static.metacritic.com/images/products/movies/9/0961583716345de658e870a1f2ea113c-98.jpg,2000-07-07,2000,7,7
11255,Two Family House,"October 6, 2000",The captivating and emotionally-charged story of a lovable loser in pursuit of his dream on Staten Island. (Lions Gate Films),79,https://static.metacritic.com/images/products/movies/5/1d89c72878d82fa032c2e9755521281b-98.jpg,2000-10-06,2000,10,6
11258,Beautiful People,"February 18, 2000","Set in October 1993 in London, this film tells the story of four families and their encounters with refugees from the former Yugoslavia.",79,https://static.metacritic.com/images/products/movies/8/3698eb9a946a9d89b8aea62b5713165f-98.jpg,2000-02-18,2000,2,18
11269,The Decline of Western Civilization Part III,"July 7, 2000",Penelope Spheeris's third installment in her documentary series examining the Los Angeles punk rock scene in the late 1990s.,77,https://static.metacritic.com/images/products/movies/98w-movie.jpg,2000-07-07,2000,7,7
11283,Kippur,"November 3, 2000","A look at the 1973 Yom Kippur War, in which Israel was attacked by Syria and Egypt on the holiest day of the Jewish calendar. Movie focuses on the fictionalized exploits of a small military unit assigned to remove the wounded from the Golan Heights combat areas.",75,https://static.metacritic.com/images/products/movies/7/9d4fed9dbad39906a1ebf5ce67c83b8d-98.jpg,2000-11-03,2000,11,3
11288,The Legend of Drunken Master,"October 20, 2000","When Chan mixes up his luggage during a train trip, he finds himself at odds with evil foreigners trying to steal sacred imperial treasures. Never before have such elaborate, acrobatic fight sequences been captured on film.  (Dimension Films)",74,https://static.metacritic.com/images/products/movies/9/ddb7bbfdf8cdb264adb098d18b05ce70-98.jpg,2000-10-20,2000,10,20
11294,Shower,"July 7, 2000","Set in and around a traditional Chinese communal bathhouse, the film chronicles changing times that put the bathhouse's future in doubt, as the son of the owner comes home to visit when he receives a postcard from his mentally challenged brother informing him that their father has died.",74,https://static.metacritic.com/images/products/movies/9/0d42e085c42c66e53d17780513219c51-98.jpg,2000-07-07,2000,7,7
11296,Cast Away,"December 22, 2000","Hanks stars as Chuck Noland, a FedEx systems engineer whose personal and professional life are ruled by the clock.   His manic existence abruptly ends when, after a plane crash, he becomes isolated on a remote island - cast away into the most desolate environment imaginable.   (Twentieth Century Fox)",73,https://static.metacritic.com/images/products/movies/7/e8d7daa97897f9315901a5750d993347-98.jpg,2000-12-22,2000,12,22
11298,Water Drops on Burning Rocks,"July 14, 2000","A 50 year old businessman falls in love with a boy of 19 in 70's Germany.  They begin a love affair, but a difference of opinion ends their ""we"" status.",73,https://static.metacritic.com/images/products/movies/5/5c5b03f94ecef48792c61bf511b20f6b-98.jpg,2000-07-14,2000,7,14
11307,The Original Kings of Comedy,"August 18, 2000","February 26 and 27, 2000, the Original Kings of Comedy play Charlotte, NC. The themes are Blacks and Whites, men and women, old-school and hip-hop. Steve Harvey emcees, celebrates '70s music and lyrics of love, and pokes at folks in the front row. D.L. Hughley mines racial differences and talks about his marriage. Cedric the Entertainer riffs on a Black president and on being grown up. Bernie Mac, who says he expresses what's in the back of our minds, closes with reflections on being 42 (new aspects to his sex life and his attitude toward children). Spike Lee's camera takes us backstage and off-stage with the Kings and into the crowd where everyone's laughing.",73,https://static.metacritic.com/images/products/movies/4/d8bea599af2f24eb4b910344bb593730-98.jpg,2000-08-18,2000,8,18
11319,Quills,"November 22, 2000","Quills boldly enters the debate surrounding the Marquis De Sade by imagining his final days as a blistering black comedy thriller, a battle between lust and love - and between the brutality of censorship and the unpredictable consequences of free expression.  (Fox Searchlight)",70,https://static.metacritic.com/images/products/movies/5/d944ab45110a705f6cae3aa0ab4abe91-98.jpg,2000-11-22,2000,11,22
11321,Hamlet,"May 12, 2000","Michael Almereyda's update of the Shakespeare play, starring Ethan Hawke as the young prince of the Denmark Corporation film empire.",70,https://static.metacritic.com/images/products/movies/9/40e9c55cd406d979ac1ff62842d88024-98.jpg,2000-05-12,2000,5,12
11326,The Emperor's New Groove,"December 15, 2000","Emperor Kuzco (David Spade) is turned into a llama by his devious advisor, Yzma (Eartha Kitt), and her hunky henchman, Kronk (Patrick Warburton). Now the ruler who once had it all must form an unlikely alliance with a pleasant peasant named Pacha (John Goodman). Together, they must overcome their differences as they embark on a hilarious, ""groovy"" adventure. [Walt Disney Pictures]",70,https://static.metacritic.com/images/products/movies/5/b273383624e5aed5cfa9aedf9f8f518d-98.jpg,2000-12-15,2000,12,15
11329,Butterfly Tongues,"June 16, 2000","Explores the extraordinary relationship between a shy young boy, Moncho (Lozano), and his incredibly compassionate teacher, Don Gregorio (Gomez), who teaches Moncho to find his way in a world that is increasingly frightening.  (Miramax Films)",69,https://static.metacritic.com/images/products/movies/0/c27ac5d91d317685dcbcb3fe1ed898c6-98.jpg,2000-06-16,2000,6,16
11330,Small Time Crooks,"May 19, 2000","A dumb crook, his wife and their gang of misfits strike it really big when a botched bank job's cover business becomes a spectacular success.",69,https://static.metacritic.com/images/products/movies/1/0bed9eb0e2500f8891f2405778888c7d-98.jpg,2000-05-19,2000,5,19
11332,The Last September,"April 21, 2000","An elderly couple reside over a country estate in 1920s Ireland. They have living with them a niece, a nephew and a couple who are homeless and trying to hide this fact. All of these individuals are thrown into turmoil when one more guest arrives.",69,https://static.metacritic.com/images/products/movies/9/ef978388f43d79273862bb12438957d5-98.jpg,2000-04-21,2000,4,21
11335,The Eyes of Tammy Faye,"July 21, 2000",A documentary about the life and times of televangelist Tammy Faye Bakker Messner.,69,https://static.metacritic.com/images/products/movies/2/8cbc4dd781e368127f35ed6712c42238-98.jpg,2000-07-21,2000,7,21
11336,Adorenarin doraibu,"May 5, 2000","Suzuki (Ando), a meek and indecisive car rental clerk, gets into a life changing car accident with a Japanese gangster. While Suzuki awaits his retribution in the mob's headquarters, comedic fate steps in with an explosion that rips through the building. Nurse Shizuko (Ishida), Suzuki's female counterpart, rescues him from the blast and the two find love running off with the mob's money, while being chased by the only surviving gangster. (Shooting Gallery)",69,https://static.metacritic.com/images/products/movies/4/07a61d18e23c37c4aac292c4e51fd9ca-98.jpg,2000-05-05,2000,5,5
11341,Santitos,"January 28, 2000",Alejandro Springall directs this Spanish-language film about a pious widow Esperanza (Heredia) who uses magic to try and locate her lost and presumed dead daughter who she believes was the victim of a mysterious virus and all kinds of other lurid happenings.,68,https://static.metacritic.com/images/products/movies/5/86ce642b3438d45add2f149b223b166e-98.jpg,2000-01-28,2000,1,28
11348,La nouvelle Ève,"May 5, 2000","A portrait of a restless, impulsive Parisiane who throws herself with abandon into relationships with men and women. When she falls madly in love with a man who is happily married with two children, it does not occur to her that breaking up his marriage might be wrong. When he resists, she literally throws herself into the arms of another man to make him jealous and to assuage her wounded pride.",66,https://static.metacritic.com/images/products/movies/2/49f0bfc8b3ae5bfc2c226a0d91d87dd1-98.jpg,2000-05-05,2000,5,5
11352,Pola X,"September 8, 2000",An incestual relationship develops between a young author (Depardieu) and his long-lost sister (Golubyova).,65,https://static.metacritic.com/images/products/movies/6/97120780db72dbc0302e561c619a615f-98.jpg,2000-09-08,2000,9,8
11356,Vénus beauté (institut),"October 27, 2000","This film takes us into this world of beauty and self image and into the lives of four strong, smart women who make their living practicing beauty at a Parisian spa.  (Lot 47 Films)",64,https://static.metacritic.com/images/products/movies/5/f9634419235204cfaf0038879a97d503-98.jpg,2000-10-27,2000,10,27
11369,Finding Forrester,"December 20, 2000",An uplifting story about the unusual dynamic between an isolated author (Connery) and the confident teenager (Brown) who changes his life.  (Sony Pictures Entertainment),62,https://static.metacritic.com/images/products/movies/3/df3794bfc8ff44c71c9bde2646d705dc-98.jpg,2000-12-20,2000,12,20
11373,Dancer in the Dark,"September 22, 2000","Bjork stars as Selma, a Czech immigrant and single mother working in a factory in rural America. She is losing her eyesight and her 10 year-old son stands to suffer the same fate if she can't put away enough money to secure him an operation. (FilmFour)",61,https://static.metacritic.com/images/products/movies/7/1956afd976ccf76571797dfe1291985f-98.jpg,2000-09-22,2000,9,22
11374,One,"October 13, 2000",The dramatic story of two young men whose friendship deteriorates as their lives take different directions.  (Shooting Gallery),61,https://static.metacritic.com/images/products/movies/9/99f20b7119dbb18fca80f2f53d5cc7c3-98.jpg,2000-10-13,2000,10,13
11375,Goya in Bordeaux,"September 15, 2000","Explores the experiences and artistic evolution of Francisco Goya, the man considered to be the most important artist of the modern era.  (Sony Pictures Classics)",61,https://static.metacritic.com/images/products/movies/6/2f3ffbe5c76b4c11ec7f06f1e5e62790-98.jpg,2000-09-15,2000,9,15
11379,Luminous Motion,"May 19, 2000","A mother and her 10-year old son, who has an active fantasy life, drive across the country on the proceeds of the mother's trick-turning; that is, until her car dies.  She temporarily moves in with a hardware store owner, and the boy's father tries to track them down.",60,https://static.metacritic.com/images/products/movies/98w-movie.jpg,2000-05-19,2000,5,19
11384,Mission: Impossible II,"May 24, 2000","Ethan Hunt (Tom Cruise) leads his IMF team to capture and destroy a German-manufactured virus before it falls in the wrong, potentially deadly hands.",59,https://static.metacritic.com/images/products/movies/5/06c0c2ccd8fc8053f651e4132c53a2e7-98.jpg,2000-05-24,2000,5,24
11388,The Contender,"October 13, 2000",Sex secrets from a U.S. Senator's (Allen) past come to light as she is nominated for Vice President.,59,https://static.metacritic.com/images/products/movies/1/85c58396d10d3d43cfc655d05162d12d-98.jpg,2000-10-13,2000,10,13
11391,The Wisdom of Crocodiles,"July 14, 2000","Searching for an ideal woman, Steven (Law), a ""vampire"" type in London, craves the intimacy of women.  He meets a strong woman named Anne and it is clear only one of them will survive.",58,https://static.metacritic.com/images/products/movies/2/6bc52e6562366b03cb262f5455c89bd7-98.jpg,2000-07-14,2000,7,14
11393,The Trench,"November 22, 2000","Focusing on an idealistic group of young World War One soldiers, this film dramatizes the forty-eight hours preceding the 1916 Battle of the Somme.",58,https://static.metacritic.com/images/products/movies/6/9b198281445ca934210986678ca229f0-98.jpg,2000-11-22,2000,11,22
11394,The Yards,"October 20, 2000","A drama set in the vast New York City subway yards.  After serving time in prison for taking the fall for a group of his friends, Leo Handler (Wahlberg) just wants to get his life back on track.  So, Leo returns to the one place he thinks will be safe -- home.  But in the yards, where his uncle (Caan) now pulls the strings, safe is not how they do business.  (Miramax Films)",58,https://static.metacritic.com/images/products/movies/2/dd9b482876f1b68b1d3aaec3de48f2e3-98.jpg,2000-10-20,2000,10,20
11397,What's Cooking?,"October 27, 2000","You are invited to a tasty Thanksgiving dinner that will all at once transport you to four different worlds and take you home again.  Coming together is the theme of What's Cooking?, Gurinder Chadha's funny, mouthwatering and deeply moving vision of 21st century diversity and the future of the American family - all set on Thanksgiving.  (Trimark Pictures)",57,https://static.metacritic.com/images/products/movies/1/ebc6924386707b7a85b19c40edec38b1-98.jpg,2000-10-27,2000,10,27
11399,Sasayaki,"November 17, 2000",A beautifully crafted and darkly comic exploration of innocence and perversity. Shiota gets a great deal of mileage out of the extreme contrast between the film's placid surface - that of a lightweight teen romance - and it's underlying themes of sexual degradation and control.  (Viz Films),57,https://static.metacritic.com/images/products/movies/9/24910d76a0081631d32d65c9840b45d9-98.jpg,2000-11-17,2000,11,17
11400,The Tavern,"September 22, 2000",Best friends Ronnie and Dave struggle to run a Manhattan tavern and find their self-respect.  (Redeemable Features),57,https://static.metacritic.com/images/products/movies/6/544e9506b1f529194da951a2eeaece36-98.jpg,2000-09-22,2000,9,22
11407,Claire Dolan,"February 25, 2000","Claire Dolan (Cartlidge) is an immigrant who works as a prostitute in New York City in order to pay off an ever-escalating debt to her pimp. When her mother dies in a local nursing home, Claire attempts to extricate herself from her life as a call girl.  (New Yorker Films)",56,https://static.metacritic.com/images/products/movies/1/ad2cf0171177eb582f938f1737fedaf8-98.jpg,2000-02-25,2000,2,25
11410,Men of Honor,"November 10, 2000","Inspired by the life of Carl Brashear (Gooding, Jr.). The setting of his journey is the little known and dangerous world of deep-sea diving in the U.S. Navy of the 1950s and 60s.  (20th Century Fox Films)",56,https://static.metacritic.com/images/products/movies/0/bcf9650d1e00bca6e6f8976baba66169-98.jpg,2000-11-10,2000,11,10
11411,Dinosaur,"May 19, 2000","When a meteor shower destroys their home, Aladar and his family follow a herd of dinosaurs heading for the safety of the ""nesting grounds."" Along the way, Aladar befriends other colorful dinosaurs. Together, they must stand strong amidst food and water shortages, the threat of carnotaur attacks, and Aladar's run-ins with the herd's stubborn leader, Kron.",56,https://static.metacritic.com/images/products/movies/0/f4cb63f303af508da47abc06d46f1f83-98.jpg,2000-05-19,2000,5,19
11416,CyberWorld,"October 6, 2000","Phig (Elfman) gives us a tour of CyberWorld, a museum of 3-D exhibits including segments from ""Antz,"" ""The Simpsons"" and several shorts.",55,https://static.metacritic.com/images/products/movies/2/aeae0f1d9b266ac26cba5decd51638e2-98.jpg,2000-10-06,2000,10,6
11420,Bamboozled,"October 6, 2000","An Ivy-League educated writer (Damon Wayans) joins a comedy show at a major network.  The show includes an all black cast,  but is written by mostly white people.  One of his first ideas is to have a skit where the cast wears ""black face,"" and the show becomes an instant smash.",54,https://static.metacritic.com/images/products/movies/5/8ad351aa6342feaf55ceec294383473a-98.jpg,2000-10-06,2000,10,6
11421,Return to Me,"April 7, 2000",A young man (Duchovny) falls in love with a woman (Driver) and later learns she is the one who received his former wife's heart. He must decide which woman it is who holds his heart.,54,https://static.metacritic.com/images/products/movies/8/865cddab1692cc1efe5528d3829d8136-98.jpg,2000-04-07,2000,4,7
11426,The Big Tease,"January 28, 2000","Scottish hairdresser Crawford Mackenzie (Ferguson), Glasgow's finest, has come to compete in The World Freestyle Hairdressing Championship, where fashion is queen and the perfect ""do"" will make you king.  (Warner Brothers)",53,https://static.metacritic.com/images/products/movies/4/95f9aca7b5c4dd7441dfb951085a3520-98.jpg,2000-01-28,2000,1,28
11427,Bounce,"November 17, 2000","A romantic drama about two strangers, a hot shot urban ad exec (Affleck) and a struggling single mom (Paltrow), who fall in love -- only one of them knows it wasn't by chance.  (Miramax Films)",52,https://static.metacritic.com/images/products/movies/8/542367a3d452b1c74142a4be8fbbea78-98.jpg,2000-11-17,2000,11,17
11428,Charlie's Angels,"November 3, 2000","A trio of elite private investigators (Diaz, Barrymore, Liu) armed with the latest in high-tech tools track down a kidnapped computer ace and keep his top-secret voice-identification software out of lethal hands.  [Columbia Pictures]",52,https://static.metacritic.com/images/products/movies/1/194212913a2a40cc006cba2211a571c6-98.jpg,2000-11-03,2000,11,3
11430,Orfeu,"August 25, 2000",The re-telling of the Greek mythical love affair between Orfeu and Eurídice transplanted to modern-day Brazil.  (New Yorker Films),52,https://static.metacritic.com/images/products/movies/4/a8af66df9769843933c0cafffaacb2c4-98.jpg,2000-08-25,2000,8,25
11433,Center Stage,"May 12, 2000",A drama that follows the hopes and dreams of a tight-knit group of young dance students as they try to make a name for themselves and become stars in the fiercely competitive world of professional dance.,52,https://static.metacritic.com/images/products/movies/8/5909eba33f7b110adbe94746de6cb820-98.jpg,2000-05-12,2000,5,12
11441,Shaft,"June 16, 2000",A murderer tries to kill the only witness to his last crime.  Shaft (Jackson) and his sidekick (Williams) are trying to catch the murderer.,50,https://static.metacritic.com/images/products/movies/4/24ce648137c634d386d2e493bef7cfcf-98.jpg,2000-06-16,2000,6,16
11452,Vertical Limit,"December 8, 2000","Tale of young climber Peter Garrett (O'Donnell), who must launch a treacherous and extraordinary rescue effort up K2, the world's second highest peak. Confronting both his own limitations and the awesome power of nature' uncontrollable elements, Peter risks his life to save his sister, Annie (Tunney), and her summit team (Paxton and Lea) in a race against time.  (Columbia Pictures)",48,https://static.metacritic.com/images/products/movies/4/ce1b02bd7e83630850eef4da7cad8ae4-98.jpg,2000-12-08,2000,12,8
11457,Lies,"November 17, 2000","In South Korea, an affair begin between two individuals who meet through a personal ads.  J (Lee) is 38-year-old married man and Y (Kim) is a young girl of 18 who wants to lose her virginity.  As things progress, the two find themselves in the realms of obssession and sadomasochism.",47,https://static.metacritic.com/images/products/movies/0/5b01f9f07f2f0f548ad0414d61989c4f-98.jpg,2000-11-17,2000,11,17
11465,The Woman Chaser,"June 16, 2000","Richard (Warburton) is a gifted used car salesman and women-chaser.  One day he completes a cherished project, but forces beyond his control destroy it.  A monstrous revenge is exacted on all who have crossed him.",46,https://static.metacritic.com/images/products/movies/3/7562077c393c117c5323a1e5ff7ff8a7-98.jpg,2000-06-16,2000,6,16
11467,Catfish in Black Bean Sauce,"July 28, 2000","An African American couple (Winfield and Alice) adopt two orphans from a Vietnamese refugee camp.  After twenty-two years, the children are reunited with their birth mother, bringing deeply submerged resentments and misconceptions to the surface and forcing the characters to reexamine their identity and relationships in both comical and poignant situations.  (Iron Hill Pictures)",46,https://static.metacritic.com/images/products/movies/5/7fdde3bf926fa31a5c6c8417b586d523-98.jpg,2000-07-28,2000,7,28
11473,Bootmen,"October 6, 2000","The story of two brothers in Newcastle, Australia.  One (Garcia) wants to pursue a career as a tap dancer, and the other (Worthington) wants to start his own business.",45,https://static.metacritic.com/images/products/movies/7/4d9fd4e571039c4a27c1c833013b81d9-98.jpg,2000-10-06,2000,10,6
11476,Coming Soon,"May 12, 2000","When it becomes clear that one of three female college friends has never had an orgasm, they set out on sexual adventures (notice the punny title, a la ""Porky's"") to remedy the situation.",44,https://static.metacritic.com/images/products/movies/0/10776a3abd03f8f2edbf4bf16b267769-98.jpg,2000-05-12,2000,5,12
11477,Love & Sex,"August 25, 2000",Follows the romantic misadventures of a woman and a man in search of their own version of happily-ever-after. (Lions Gate Films),44,https://static.metacritic.com/images/products/movies/98w-movie.jpg,2000-08-25,2000,8,25
11485,A Piece of Eden,"September 15, 2000",A bittersweet comedy that follows three generations of the unlucky Tredici family from Corsica in the 1940's to an Indiana fruit farm in the present.  (FilmAcres),43,https://static.metacritic.com/images/products/movies/4/bacbb62b4bb217015f55141499165425-98.jpg,2000-09-15,2000,9,15
11490,The Family Man,"December 22, 2000","In this romantic comedy drama about life's possibilities, Jack Campbell (Cage) must choose between a his glamorous, fast-paced career or life as a suburban husband and father.  (Universal Pictures)",42,https://static.metacritic.com/images/products/movies/0/046d94bd6b7d073998d009945963b52a-98.jpg,2000-12-22,2000,12,22
11494,Godzilla 2000,"August 18, 2000","Godzilla faces a formidable new foe in Orga (a.k.a. Giant Alien Millennian), a gigantic and lethal creature which is slowly transmuted from a UFO believed to be dormant for 6,000 years.  [Columbia Tristar]",41,https://static.metacritic.com/images/products/movies/5/70a2a054958b20935b16a62620ae3f00-98.jpg,2000-08-18,2000,8,18
11495,Luminarias,"May 5, 2000","Four  women regularly get-together at an East Los Angeles restaurant called Luminarias to share information about their careers, love, family, and sex.",41,https://static.metacritic.com/images/products/movies/98w-movie.jpg,2000-05-05,2000,5,5
11501,Duets,"September 15, 2000",Karaoke enthusiasts travel across the country competing in singing contests leading to the national championship in Omaha.,40,https://static.metacritic.com/images/products/movies/9/7b9391cc42669888a917c9e1523fd5be-98.jpg,2000-09-15,2000,9,15
11514,Reindeer Games,"February 25, 2000",The film enters the colorful and conniving world of lowlife criminals scheming to turn a straightened ex-con (Affleck) crooked again.  (Dimension Films),37,https://static.metacritic.com/images/products/movies/9/520f871df3b365f2583cc0f22f880590-98.jpg,2000-02-25,2000,2,25
11479,The Ninth Gate,"March 10, 2000",A rare book dealer (Depp) seeking out the last two copies of a demon text discovers a strange demonic conspiracy.,44,https://static.metacritic.com/images/products/movies/1/48a0fd83aa6925300482d527b113b521-98.jpg,2000-03-10,2000,3,10
11480,The Closer You Get,"February 25, 2000","A group of bachelors in a shrinking village on Ireland's craggy Donegal coast scheme to entice American beauties to the village.  When their plan goes awry, the result is an unexpected round of romances with the least likely of women -- the one's who've been right in front of them all along.  (Fox Searchlight Pictures)",44,https://static.metacritic.com/images/products/movies/4/717b6b4cc4a600ed0d3bc465bc2cdc29-98.jpg,2000-02-25,2000,2,25
11496,Next Friday,"January 12, 2000","Takes up where ""Friday"" left off with the action switching from South Central L.A. to suburbia.  (New Line Home Video)",41,https://static.metacritic.com/images/products/movies/7/6b6e04d837faa5a7c03d5487009aa47d-98.jpg,2000-01-12,2000,1,12
11502,The Cell,"August 18, 2000",A child therapist enters the mind of a comatose serial killer in the hopes of saving his latest victim.,40,https://static.metacritic.com/images/products/movies/1/68d2a2344af8d5ae63a76be95095b836-98.jpg,2000-08-18,2000,8,18
11503,Bait,"September 15, 2000","Alvin Sanders (Foxx) is set up as bait by Treasury Agent Clenteen (Morse) to trap a dangerous criminal (Hutchison). The Feds think Alvin was given a secret code in jail that would lead to gold in the U.S. Treasury.  Alvin just wants to go straight, but ...",39,https://static.metacritic.com/images/products/movies/3/07421ea88d1c20003e5f6ea00522b135-98.jpg,2000-09-15,2000,9,15
11504,Restless,"November 10, 2000",A young American woman (Kellner) and her Chinese and American friends seek adventure and romance in China.,39,https://static.metacritic.com/images/products/movies/2/77189aa0cd93585c7b8c122a0d677f27-98.jpg,2000-11-10,2000,11,10
11505,All the Rage,"July 7, 2000",A holdup at gunpoint affects the lives of a cross section of people in a variety of ways in this dark comedy.,39,https://static.metacritic.com/images/products/movies/0/f33738460cf4c213b78f7bbe6ca449d2-98.jpg,2000-07-07,2000,7,7
